0,1,2,3
1,Who coined the term 'machine learning' in 1959?,"('a: Donald Hebb | b: Alan Turing | c: Arthur Samuel | d: Ian Goodfellow',)",c
2,"During the early period of machine learning, what synonym was also used for the field?","('a: Artificial Intelligence | b: Self-teaching computers | c: Computational Cognition | d: Neural Pattern Recognition',)",b
3,"Which researcher published the book 'The Organization of Behavior' in 1949, setting groundwork for neural theories?","('a: Walter Pitts | b: Warren McCulloch | c: Nils Nilsson | d: Donald Hebb',)",d
4,What did Walter Pitts and Warren McCulloch propose that mirrored human thought processes?,"('a: The checkers algorithm | b: A mathematical model of neural networks | c: Generative Adversarial Networks (GANs) | d: Reinforcement learning techniques',)",b
5,"What experimental 'learning machine,' developed by Raytheon Company in the 1960s, was used to analyze signals like sonar and speech?","('a: AlphaGo | b: The Checkers Program | c: Cybertron | d: GAN-Net',)",c
6,"According to Tom M. Mitchell's definition, what three elements must be considered for a program to be said to 'learn'?","('a: Data, Code, and Time | b: Experience (E), Tasks (T), and Performance Measure (P) | c: Input, Output, and Training Set | d: Neurons, Connections, and Weights',)",b
7,"In his paper 'Computing Machinery and Intelligence,' Alan Turing replaced the question 'Can machines think?' with what type of test?","('a: The Checkers Challenge | b: Analyzing sonar signals | c: Whether machines can convincingly imitate a human in responses | d: Testing pattern classification ability',)",c
8,"Which major breakthrough occurred in 2016, involving the use of reinforcement learning techniques?","(""a: The development of Cybertron | b: Ian Goodfellow's GANs | c: AlphaGo winning against top human players in Go | d: Samuel's checkers program"",)",c
9,"What was the primary focus of Nils Nilsson's book 'Learning Machines,' which dealt with research during the 1960s?","('a: Generative Adversarial Networks | b: Reinforcement learning for sonar signals | c: Machine learning for pattern classification | d: The mathematical modeling of human thought',)",c
10,"Historically, the roots of machine learning are described as being rooted in efforts to study what?","('a: Advanced computer gaming | b: Human cognitive processes | c: Sonar signal analysis | d: The development of punched tape memory',)",b
